Question,Answer,Quotes
إزاي طبيعة عمل السوق الأول أثرت على خطة جولة المتحدث؟,ذهب لسوق آخر مؤقتاً,"[{'text': 'احنا عرفنا ان هو بيجهزوا دلوقتي السوق للاجواء بالليل', 'start_char': 421, 'end_char': 476}, {'text': 'فاحنا هنروح نشوف سوق تاني ، ونرجع له بالليل', 'start_char': 479, 'end_char': 520}]"
ما الذي ميز السوق الأول الذي زاره المتحدث؟,طابعه المحلي.,"[{'text': 'دي بقى بتاعه الناس السكان المحليين مش الناس السياح', 'start_char': 232, 'end_char': 281}]"
كم بلغ سعر فاكهة الجاك فروت في السوق؟,بدولار واحد,"[{'text': 'بدولار واحد', 'start_char': 718, 'end_char': 728}]"
إيه في الجو ممكن يفسر مواعيد السوق الغريبة؟,الرطوبة العالية,"[{'text': 'الجو بقى الرطوبة عاليه ، بتوقف دقيقتين بتلاقي بقى ايه جسمك كله ميه وعرق', 'start_char': 1353, 'end_char': 1424}, {'text': 'دايما حاجات الخضار بتبقى بالنهار بدري ، فمش عارف ليه ده غريب شويه وشغال بالليل يعني', 'start_char': 1509, 'end_char': 1591}]"
إيه الصفة اللي لاحظها المتحدث في الخضار والفاكهة بالسوق؟,طزاجتهم,"[{'text': 'الفاكهه طازه والخضار شكله طازه ، ورايق وخطير بصراحه يعني', 'start_char': 487, 'end_char': 543}]"
"على أي أساس اتسمى الشارع اللي فيه سوق القطر باسم ""ترين ستريت""؟",عشان بيبقى الشارع القطورة رايحه جايه فيه,"[{'text': 'عشان بيبقى الشارع القطورة رايحه جايه فيه', 'start_char': 1172, 'end_char': 1211}]"
إيه اللي خلى مواعيد السوق الأول غريبة للمتحدث؟,مواعيده عكس المعتاد,"[{'text': 'دايما حاجات الخضار بتبقى بالنهار بدري', 'start_char': 1565, 'end_char': 1602}, {'text': 'قال ان هو شغال بالليل', 'start_char': 1629, 'end_char': 1648}]"
ما الذي ميّز أنواع المانجو في السوق الأول عن تلك المخصصة للسياح في العاصمة؟,تنوعها وعدم انتشارها,"[{'text': 'احنا دايما جوه في في في هانوي نفسها في العاصمه ، دايما في المانجا الصفرا الطويله ، دي بيقطعوها للناس للسياح في الشارع ، لكن في هنا انواع مانجا كتير ما شفتهاش جوه نهائي', 'start_char': 372, 'end_char': 532}, {'text': 'دي بقى بتاعه الناس السكان المحليين مش الناس السياح', 'start_char': 181, 'end_char': 226}]"
السوق الأول اللي زاره المتحدث كان على بعد قد إيه من المدينة؟,نص ساعه بره المدينه,"[{'text': 'وخرجنا يمكن نص ساعه بره المدينه', 'start_char': 250, 'end_char': 281}]"
ليه قرر المتحدث يرجع للسوق الأول في وقت تاني؟,لأنه يعمل مساءً,"[{'text': 'فاحنا هنروح نشوف سوق تاني ، ونرجع له بالليل', 'start_char': 1215, 'end_char': 1255}, {'text': 'سالت حد قال زي ما سمعتو يعني ، قال ان هو شغال بالليل', 'start_char': 1967, 'end_char': 2021}]"
ما هي طبيعة السوق الأول الذي زاره المتحدث من حيث زواره؟,سوق محلي,"[{'text': 'دي بقى بتاعه الناس السكان المحليين مش الناس السياح', 'start_char': 181, 'end_char': 226}, {'text': 'احنا بعدنا بعيد تماما عن السياحه وعن المدينه', 'start_char': 229, 'end_char': 270}]"
إيه هو اليوم المفضل للمتحدث في رحلاته لآسيا؟,يوم الماركتز,"[{'text': 'ده احلى يوم بحبه في رحلات اسيا ، يوم الماركتز', 'start_char': 0, 'end_char': 45}]"
مواعيد السوق في هانوي بتشير لإيه عن روتين سكانها اليومي؟,إنه مسائي أكتر,"[{'text': 'عرفنا ان هو بيجهزوا دلوقتي السوق للاجواء بالليل', 'start_char': 1003, 'end_char': 1046}, {'text': 'دايما حاجات الخضار بتبقى بالنهار بدري ، فمش عارف ليه ده غريب شويه وشغال بالليل يعني', 'start_char': 1756, 'end_char': 1844}]"
ما الذي كان يفعله البائعون في السوق الأول عند وصول المتحدث؟,تجهيز السوق,"[{'text': 'بس حاسس ان ايه ، ان مافيش حياه اوي يعني حاسس ان الناس معظمها قفل ، شويه', 'start_char': 669, 'end_char': 742}, {'text': 'عرفنا ان هو بيجهزوا دلوقتي السوق للاجواء بالليل', 'start_char': 1003, 'end_char': 1046}]"
ما هو سعر فاكهة الجاك فروت المذكور في النص؟,بدولار واحد,"[{'text': 'بدولار واحد', 'start_char': 587, 'end_char': 597}]"
إيه اللي خلى المتحدث يروح سوق القطر قبل ما يرجع للسوق الأول؟,السوق الأول بيشتغل بالليل,"[{'text': 'فاحنا هنروح نشوف سوق تاني ، ونرجع له بالليل', 'start_char': 1215, 'end_char': 1254}, {'text': 'سالت حد قال زي ما سمعتو يعني ، قال ان هو شغال بالليل', 'start_char': 2052, 'end_char': 2107}]"
كيف كان انطباع المتحدث عن السوق الأول عند وصوله؟,أنه غير حيوي,"[{'text': 'بس حاسس ان ايه ، ان مافيش حياه اوي يعني حاسس ان الناس معظمها قفل ، شويه', 'start_char': 669, 'end_char': 742}]"
إيه وسيلة المواصلات اللي طلبها المتحدث عشان يروح الترين ستريت؟,سكوتر,"[{'text': 'طيب طلبنا سكوتر يجي ياخدنا', 'start_char': 1272, 'end_char': 1296}]"
إيه اللي بيوضحه استغراب المتحدث عن أسواق الخضار في بلده؟,إنها تعمل صباحاً,"[{'text': 'دايما حاجات الخضار بتبقى بالنهار بدري ، فمش عارف ليه ده غريب شويه وشغال بالليل يعني', 'start_char': 1876, 'end_char': 1963}, {'text': 'سالت حد قال زي ما سمعتو يعني ، قال ان هو شغال بالليل', 'start_char': 1966, 'end_char': 2014}]"
لماذا قرر المتحدث مغادرة السوق الأول والعودة إليه لاحقًا؟,لأنه يعمل ليلاً,"[{'text': 'بس حاسس ان ايه ، ان مافيش حياه اوي يعني حاسس ان الناس معظمها قفل', 'start_char': 703, 'end_char': 768}, {'text': 'احنا عرفنا ان هو بيجهزوا دلوقتي السوق للاجواء بالليل', 'start_char': 907, 'end_char': 961}]"
كيف وصف المتحدث حالة الجو في هانوي؟,الجو بقى الرطوبه عاليه,"[{'text': 'الجو بقى الرطوبه عاليه', 'start_char': 1686, 'end_char': 1707}]"
ليه المتحدث قرر يرجع للسوق الأولاني بعدين؟,لأنه بيشتغل بالليل.,"[{'text': 'احنا عرفنا ان هو بيجهزوا دلوقتي السوق للاجواء بالليل ، فاحنا هنروح نشوف سوق تاني ، ونرجع له بالليل', 'start_char': 1121, 'end_char': 1220}, {'text': 'سالت حد قال زي ما سمعتو يعني ، قال ان هو شغال بالليل', 'start_char': 1868, 'end_char': 1914}]"
"ما هو سبب تسمية ""شارع القطار"" بهذا الاسم؟",لمرور القطارات فيه.,"[{'text': 'عشان بيبقى الشارع القطورة رايحه جايه فيه', 'start_char': 1445, 'end_char': 1484}]"
كم تبعد المسافة بين المدينة والسوق الأول الذي زاره المتحدث؟,نص ساعه بره المدينه,"[{'text': 'نص ساعه بره المدينه', 'start_char': 241, 'end_char': 261}]"
إزاي اكتشاف مواعيد السوق الأول غيّر خطة المتحدث؟,هيزور سوق تاني ويرجعله,"[{'text': 'عرفنا ان هو بيجهزوا دلوقتي السوق للاجواء بالليل', 'start_char': 433, 'end_char': 476}, {'text': 'فاحنا هنروح نشوف سوق تاني ، ونرجع له بالليل', 'start_char': 480, 'end_char': 521}]"
ما مدى شعبية سوق القطار الذي ذكره المتحدث؟,عالمية,"[{'text': 'والناس بتجي بقى مخصوص من كل مكان في العالم عشان تحضر الماركت ده', 'start_char': 1316, 'end_char': 1381}]"
إيه نوع المانجا المنتشر في العاصمة هانوي؟,المانجا الصفرا الطويله,"[{'text': 'المانجا الصفرا الطويله', 'start_char': 443, 'end_char': 464}]"
وفقًا لوصف المتحدث للطقس، ما ميزة عمل السوق ليلًا؟,تجنب الرطوبة العالية,"[{'text': 'احنا عرفنا ان هو بيجهزوا دلوقتي السوق للاجواء بالليل', 'start_char': 1020, 'end_char': 1072}, {'text': 'الجو بقى الرطوبه عاليه ، بتوقف دقيقتين بتلاقي بقى ايه جسمك كله ميه وعرق', 'start_char': 1541, 'end_char': 1622}]"
ما طبيعة زيارة المتحدث لأسواق فيتنام؟,سياحية,"[{'text': 'دي بقى بتاعه الناس السكان المحليين مش الناس السياح', 'start_char': 196, 'end_char': 240}, {'text': 'احنا بعدنا بعيد تماما عن السياحه وعن المدينه', 'start_char': 242, 'end_char': 287}]"
ما هو الانطباع الأول للمتحدث عن الفاكهة والخضار بالسوق؟,الفاكهه طازه والخضار شكله طازه ، ورايق وخطير بصراحه يعني,"[{'text': 'الفاكهه طازه والخضار شكله طازه ، ورايق وخطير بصراحه يعني', 'start_char': 532, 'end_char': 591}]"
إيه الفرق الجوهري بين رواد السوق الأول وسوق القطار؟,الأول للمحليين والتاني للسياح,"[{'text': 'دي بقى بتاعه الناس السكان المحليين مش الناس السياح', 'start_char': 191, 'end_char': 238}, {'text': 'والناس بتجي بقى مخصوص من كل مكان في العالم عشان تحضر الماركت ده', 'start_char': 1205, 'end_char': 1271}]"
كيف يختلف سعر بعض الفواكه في فيتنام عن بلد المتحدث؟,أرخص بكثير.,"[{'text': 'دراجون فروت مرميه في الارض .', 'start_char': 831, 'end_char': 858}, {'text': 'متخيلين دي بتتحط عندنا بتتحط جوه التلاجه ، مقفول عليها وحاطين سعر مثلا ايه 1000 جنيه او 70 الف درهم', 'start_char': 859, 'end_char': 956}]"
كم كان سعر فاكهة الجاك فروت في السوق؟,بدولار واحد,"[{'text': 'اه دي بقى الجاك فروت ، جاك فروت اوكي ، بدولار واحد', 'start_char': 605, 'end_char': 651}]"
