Question,Answer,Quotes
إيه كانت نتيجة سياسة المداورة على هجوم ليفربول؟,إضاعة العديد من الفرص,"[{'text': 'عشان كده فريق ليفربول هو كان عنده تفكير منطقي انه بدا يفكر في سياسه المدوره بدايه من المباراه قصاد فريق كريستال بالاس .', 'start_char': 1116, 'end_char': 1238}, {'text': 'ولكن تناوب لعيبه الخط الامامي على تضييع الفرص هو كالعاده اللي كان سبب في ان ليفربول في ماتش المفروض ان هو كان نظريا سهله عليه اتعقد اكتر واكتر', 'start_char': 1783, 'end_char': 1934}]"
إيه الميزة الجسدية اللي بيمتلكها ماتيتا على كوتيه؟,الطول.,"[{'text': 'يعني ماتيتا اعتقد ده اللاعيب الوحيد اللي في الكوكب الاطول من كوتيه اساسا', 'start_char': 1585, 'end_char': 1657}]"
إزاي تم وصف مستوى الحارس التالت جاروس في المباراة؟,مستوى مقبول.,"[{'text': 'مستوى مقبول', 'start_char': 180, 'end_char': 191}]"
ما النتيجة غير المقصودة لسياسة تدوير ليفربول ضد بالاس؟,تضييع فرص الخط الأمامي,"[{'text': 'عشان كده فريق ليفربول هو كان عنده تفكير منطقي انه بدا يفكر في سياسه المدوره بدايه من المباراه قصاد فريق كريستال بالاس .', 'start_char': 1358, 'end_char': 1476}, {'text': 'ولكن تناوب لعيبه الخط الامامي على تضييع الفرص هو كالعاده اللي كان سبب في ان ليفربول في ماتش المفروض ان هو كان نظريا سهله عليه اتعقد اكتر واكتر', 'start_char': 1902, 'end_char': 2041}]"
,,
إيه المدة اللي ممكن يحتاجها أليسون للراحة بسبب إصابته؟,ممكن اكتر من تلات او اربع اسابيع.,"[{'text': 'ممكن اكتر من تلات او اربع اسابيع', 'start_char': 374, 'end_char': 405}]"
إيه العلاقة بين المداورة واختبار تطور ليفربول؟,المداورة تحضير للاختبار,"[{'text': 'هيدخل اختبارات شقه وقاسيه ورا بعض هتحدد فعلا اذا كان الفريق مع ارني سلوت قدر ان هو يتطور ولا لسه الفريق قدامه شويه عشان يقدر ان هو يحسن اموره .', 'start_char': 987, 'end_char': 1147}, {'text': 'عشان كده فريق ليفربول هو كان عنده تفكير منطقي انه بدا يفكر في سياسه المدوره بدايه من المباراه قصاد فريق كريستال بالاس .', 'start_char': 1221, 'end_char': 1345}]"
إزاي تم وصف حالة فريق كريستال بالاس تحت قيادة جلاسنر؟,مُثيرة للتساؤل.,"[{'text': 'ويمكن حاله كريستال بالاس دي واحده من الحاجات اللي عليها علامات استفهام كتيره', 'start_char': 1386, 'end_char': 1464}]"
مين اللي صعب الماتش على ليفربول قصاد كريستال بالاس حسب النص؟,ليفربول هو اللي صعب الماتش على نفسه.,"[{'text': 'ليفربول هو اللي كان مصعب المباراه على نفسه', 'start_char': 1704, 'end_char': 1744}]"
ما هو الخطر المحتمل الذي كان يتجنبه المدرب بسياسة التدوير؟,إرهاق اللاعبين,"[{'text': 'هيدخل اختبارات شقه وقاسيه ورا بعض هتحدد فعلا اذا كان الفريق مع ارني سلوت قدر ان هو يتطور ولا لسه الفريق قدامه شويه عشان يقدر ان هو يحسن اموره .', 'start_char': 887, 'end_char': 965}, {'text': 'عشان كده فريق ليفربول هو كان عنده تفكير منطقي انه بدا يفكر في سياسه المدوره بدايه من المباراه قصاد فريق كريستال بالاس .', 'start_char': 966, 'end_char': 1072}]"
إيه اللي حصل للمباراة اللي كانت نظرياً سهلة على ليفربول؟,ازدادت صعوبتها.,"[{'text': 'ان ليفربول في ماتش المفروض ان هو كان نظريا سهله عليه اتعقد اكتر واكتر', 'start_char': 1790, 'end_char': 1860}]"
مين اللاعب المتوقع يرجع ليكون الحارس الأساسي لليفربول؟,كيليهير.,"[{'text': 'ومتوقع ان كيليهير يرجع مره تانيه يكون الحارس الاساسي لفريق ليفربول فيما هو قادم .', 'start_char': 599, 'end_char': 681}]"
كيف يختلف نهج بناء الفريق بين برشلونة وريال مدريد؟,برشلونة بالناشئين ومدريد بالصفقات.,"[{'text': 'بص النهارده ريال مدريد على مدار تاريخه لم يستغل قطاع الناشئين بتاعه . تبص وتتعلم النهارده اكاديميه اللمسيه .', 'start_char': 1114, 'end_char': 1205}, {'text': 'الازمه الماليه اللي جت لها دي جت لها نجده انها ما تجيبش لعيبه نجده انها ما تجيبش لعيبه وتطلع اللاعيبه اللي عندها', 'start_char': 1716, 'end_char': 1812}]"
بِمَ وصف المتحدث رئاسة فلورنتينو بيريز التاريخية؟,بالأفضلية.,"[{'text': 'فلورنتينو بيريز هو اعظم رئيس نادي جه في تاريخ العالم كله', 'start_char': 669, 'end_char': 718}, {'text': 'فلورنتينو بيريز هو فعلا انا بالنسبه لي هو افضل رئيس نادي تاريخي جا في كره القدم', 'start_char': 748, 'end_char': 826}]"
وصف المتحدث مشكلة برشلونة مع تشافي بإنها مشكلة إيه؟,مشكلة مدرب.,"[{'text': 'المشكله مشكله مدرب', 'start_char': 272, 'end_char': 289}]"
إيه اللي أجبر برشلونة على سياسته المختلفة عن ريال مدريد؟,الأزمة المالية.,"[{'text': 'الازمه الماليه اللي جت لها دي جت لها نجده انها ما تجيبش لعيبه نجده انها ما تجيبش لعيبه وتطلع اللاعيبه اللي عندها', 'start_char': 1735, 'end_char': 1827}]"
,,
كم عدد لاعبي اللامسيا الذين شاركوا في المباراة حسب وصف المتحدث؟,ست لاعيبه.,"[{'text': 'انت بتتكلم في ست لاعيبه النهارده من 11 لعيبة', 'start_char': 1390, 'end_char': 1432}]"
إزاي الأزمة المالية فادت برشلونة؟,أجبرتهم على تصعيد الناشئين.,"[{'text': 'الازمه الماليه اللي جت لها دي جت لها نجده انها ما تجيبش لعيبه وتطلع اللاعيبه اللي عندها اقسم بالله العظيم احلى مليار مره من اللعيب', 'start_char': 1892, 'end_char': 2009}]"
إيه اللي ميّز ماتش برشلونة الأخير عن باقي ماتشات الموسم من وجهة نظر المتحدث؟,الأفضلية.,"[{'text': 'انا انا النهارده احلى مباراه في الموسم بالكامل لبرشلونه', 'start_char': 1251, 'end_char': 1303}, {'text': 'شوف بقى افضل مباراه هذا الموسم لبرشلونه', 'start_char': 1342, 'end_char': 1380}]"
وصف المتحدث مركز لعب مارك كاسادو ضد ريال مدريد بإنه إيه؟,ديفندر وحيد.,"[{'text': 'بيلعب ديفندر وحيد قدام عمالقه ريال مدريد النهارده', 'start_char': 585, 'end_char': 631}]"
إيه المصدر اللي كوّن أغلبية التشكيلة الأساسية لبرشلونة حسب ما ورد في المقطع؟,أكاديمية النادي للناشئين، لاماسيا.,"[{'text': 'تبص وتتعلم النهارده اكاديميه اللمسيه . بص النهارده اللمسيه بتعمل ايه النهارده', 'start_char': 1130, 'end_char': 1192}, {'text': 'انت بتتكلم في ست لاعيبه النهارده من 11 لعيبة . ست لاعيبه لمسيه النهارده .', 'start_char': 1326, 'end_char': 1400}]"
,,
المباراة اللي وصفها المتحدث اتلعبت فين؟,في الجوهره المشعه في السعوديه.,"[{'text': 'في الجوهره المشعه في السعوديه', 'start_char': 1171, 'end_char': 1199}]"
إيه النتيجة الإيجابية لأزمة برشلونة المالية حسب رأي المتحدث؟,الاعتماد على أكاديمية لاماسيا,"[{'text': 'برشلونه بتاع يعني يعني الازمه الماليه اللي جت لها دي جت لها نجده انها ما تجيبش لعيبه وتطلع اللاعيبه اللي عندها', 'start_char': 2056, 'end_char': 2165}, {'text': 'بص النهارده ريال مدريد على مدار تاريخه لم يستغل قطاع الناشئين بتاعه . تبص وتتعلم النهارده اكاديميه اللمسيه .', 'start_char': 1215, 'end_char': 1318}, {'text': 'اقسم بالله العظيم احلى مليار مره من اللعيب اهو عندك الدليل كسبوا مرتين في الموسم ريال مدريد', 'start_char': 2166, 'end_char': 2244}]"
,,
مين اللاعبين الجداد اللي المتحدث ذكر إنهم انضموا لتشكيلة برشلونة؟,داني أولمو وباو فيكتور.,"[{'text': 'مجرد بس زاد عليه داني اولمو وباو فيكتور', 'start_char': 492, 'end_char': 531}]"
من بين قادة إسرائيل وحزب الله، من كان في مكان غير عسكري؟,بنيامين نتنياهو,"[{'text': 'نتنياهو اصدر اوامره بقتل قيادات حزب الله وعلى راسهم امينه العام هو في جناح فندق ليوس ريجنس نيويورك اوتيل الواقع على شارع بارك افينيو .', 'start_char': 1198, 'end_char': 1325}, {'text': 'كان وزير الحرب الاسرائيلي يواف جلاند استلم الاوامر من نتنياهو وبدا فورا يتابع تنفيذ الهجوم على مقر حزب الله من غرفه القياده تحت الارض التابعه لسلاح الجوي الاسرائيلي .', 'start_char': 1941, 'end_char': 2111}, {'text': 'اغتيال الامين العام لحزب الله حسن نصر الله ومجموعه من كبار القيادات معاه في مقر قيادتهم تحت الارض في الضاحيه الجنوبيه في لبنان .', 'start_char': 1099, 'end_char': 1196}]"
,,
منين كان وزير الحرب الإسرائيلي يواف جالانت بيتابع تنفيذ الهجوم؟,من غرفه القياده تحت الارض التابعه لسلاح الجوي الاسرائيلي.,"[{'text': 'من غرفه القياده تحت الارض التابعه لسلاح الجوي الاسرائيلي', 'start_char': 2041, 'end_char': 2109}]"
ما دلالة اختلاف موقعي إصدار ومتابعة أمر الاغتيال؟,القرار سياسي والتنفيذ عسكري.,"[{'text': 'نتنياهو اصدر اوامره بقتل قيادات حزب الله وعلى راسهم امينه العام هو في جناح فندق ليوس ريجنس نيويورك اوتيل الواقع على شارع بارك افينيو .', 'start_char': 1121, 'end_char': 1242}, {'text': 'كان وزير الحرب الاسرائيلي يواف جلاند استلم الاوامر من نتنياهو وبدا فورا يتابع تنفيذ الهجوم على مقر حزب الله من غرفه القياده تحت الارض التابعه لسلاح الجوي الاسرائيلي .', 'start_char': 1699, 'end_char': 1864}]"
,,
مين اللي كان واقف جنب نتنياهو في الصورة وقت إعطاء الأمر باغتيال نصرالله؟,سكرتيره العسكري ورئيس الاركان.,"[{'text': 'سكرتيره العسكري ورئيس الاركان', 'start_char': 1089, 'end_char': 1119}]"
ما طبيعة مكانيْ إصدار ومتابعة الأمر باغتيال نصر الله؟,مدني فاخر وعسكري محصن,"[{'text': 'نتنياهو اصدر اوامره بقتل قيادات حزب الله وعلى راسهم امينه العام هو في جناح فندق ليوس ريجنس نيويورك اوتيل الواقع على شارع بارك افينيو .', 'start_char': 1195, 'end_char': 1308}, {'text': 'كان وزير الحرب الاسرائيلي يواف جلاند استلم الاوامر من نتنياهو وبدا فورا يتابع تنفيذ الهجوم على مقر حزب الله من غرفه القياده تحت الارض التابعه لسلاح الجوي الاسرائيلي .', 'start_char': 1716, 'end_char': 1876}]"
,,
إيه سبب وجود نتنياهو في نيويورك وقت إصدار أمر الاغتيال؟,حضور اجتماعات الأمم المتحدة.,"[{'text': 'حضور اجتماعات الامم المتحده', 'start_char': 1065, 'end_char': 1091}]"
إلى ماذا يشير اختلاف بيئة مُصدر الأمر عن منفذه؟,فصل القيادة السياسية والعسكرية,"[{'text': 'نتنياهو اصدر اوامره بقتل قيادات حزب الله وعلى راسهم امينه العام هو في جناح فندق ليوس ريجنس نيويورك اوتيل الواقع على شارع بارك افينيو .', 'start_char': 1215, 'end_char': 1342}, {'text': 'كان وزير الحرب الاسرائيلي يواف جلاند استلم الاوامر من نتنياهو وبدا فورا يتابع تنفيذ الهجوم على مقر حزب الله من غرفه القياده تحت الارض التابعه لسلاح الجوي الاسرائيلي .', 'start_char': 2045, 'end_char': 2202}]"
,,
إيه عدد الصواريخ اللي استخدمتها إيران في ضربتها ضد الكيان المحتل؟,أكتر من 200 صاروخ بالستي.,"[{'text': 'باكتر من 200 صاروخ بالستي', 'start_char': 239, 'end_char': 265}]"
ما دلالة اختلاف موقعي القادة الإسرائيليين أثناء الهجوم؟,اختلاف طبيعة أدوارهما,"[{'text': 'نتنياهو اصدر اوامره بقتل قيادات حزب الله وعلى راسهم امينه العام هو في جناح فندق ليوس ريجنس نيويورك اوتيل الواقع على شارع بارك افينيو .', 'start_char': 1290, 'end_char': 1407}, {'text': 'كان وزير الحرب الاسرائيلي يواف جلاند استلم الاوامر من نتنياهو وبدا فورا يتابع تنفيذ الهجوم على مقر حزب الله من غرفه القياده تحت الارض التابعه لسلاح الجوي الاسرائيلي .', 'start_char': 2007, 'end_char': 2173}]"
,,
إزاي تم التأكد من مكان إقامة نتنياهو وقت إصدار أمر الاغتيال؟,"بمطابقة جناح ""الاكزاتيوتيف سويت"" في الفندق مع الصورة اللي اتنشرت له.","[{'text': 'وبالفعل لقينا الاكزاتيوتيف سويت في الفندق مطابقه تماما للي في الصوره', 'start_char': 1877, 'end_char': 1951}]"
إيه اللي حصل لرجال الأعمال بعد اجتماع شيراتون؟,احتجاز، إقامة جبرية، هروب، واستيلاء.,"[{'text': 'بعد الاجتماع تم احتجاز بعض اللي رفضوا تسليم اصول ممتلكاتهم او اسهم شركاتهم وتشحنو على فرع المخابرات 251 في دمشق', 'start_char': 1632, 'end_char': 1761}, {'text': 'والبعض التاني تم وضع قايد الاقامه الجبريه وابرزهم رامي مخلوف ابن خال بشار الاسد', 'start_char': 1764, 'end_char': 1850}, {'text': 'وفي الايام التاليه للاجتماع هرب عدد من اغنى السوريين واستولى النظام على شركاتهم واعمالهم', 'start_char': 1957, 'end_char': 2059}]"
بماذا وصف النص الإمبراطورية الاقتصادية اللي رعاها نظام بشار الأسد؟,اتصفت بالإجرام.,"[{'text': 'الحكايه دي وغيرها من مئات الحكايات بتوضح لنا ازاي نظام بشار الاسد مش بس رعى امبراطوريه اقتصاديه اجراميه وتسبب في تدمير البلد', 'start_char': 2062, 'end_char': 2182}]"
إيه الاسم اللي أطلقه المتحدث على ما طلبه حازم قرفول من رجال الأعمال؟,ضريبة حماية.,"[{'text': 'طلب منهم حاجه احنا ممكن نسميها ضريبه حمايه', 'start_char': 1195, 'end_char': 1238}]"
إزاي تصرف محافظ البنك المركزي يهدد مستقبل الاستثمار؟,يدمر الأمان الاقتصادي للمستثمرين,"[{'text': 'يجتمعوا مع حازم كارفول رئيس مصرف سوريا المركزي وقتها', 'start_char': 228, 'end_char': 271}, {'text': 'وفي النهايه طلب منهم حاجه احنا ممكن نسميها ضريبه حمايه .', 'start_char': 622, 'end_char': 671}, {'text': 'حازم كان جاي برساله بسيطه من قيادات عليا في المخابرات السوريه والقصر الجمهوري نفسه', 'start_char': 673, 'end_char': 757}]"
,,
كم تُقدر الثروة اللي استولت عليها عائلة الأسد على أقل تقدير؟,ما بين المليار وال 2 مليار دولار.,"[{'text': 'ارقام ما بين المليار وال 2 مليار دولار على اقل تقدير استولت عليها عائله الاسد', 'start_char': 2432, 'end_char': 2510}]"
إيه التحول في استراتيجية النظام الاقتصادية اللي الاجتماع كشفه؟,من التسهيلات للابتزاز المباشر,"[{'text': 'مفادها ان عصر الخدمات والتسهيلات انتهى', 'start_char': 1079, 'end_char': 1115}, {'text': 'الابتزاز العلني ده في اوساط النظام استفز بعض الحاضرين', 'start_char': 1735, 'end_char': 1787}]"
إيه اللي حصل لرجال الأعمال اللي رفضوا يسلموا ممتلكاتهم للنظام السوري بعد الاجتماع؟,الاحتجاز والإقامة الجبرية.,"[{'text': 'بعد الاجتماع تم احتجاز بعض اللي رفضوا تسليم اصول ممتلكاتهم او اسهم شركاتهم وتشحنو على فرع المخابرات 251 في دمشق ، والبعض التاني تم وضع قايد الاقامه الجبريه', 'start_char': 1933, 'end_char': 2122}]"
الرسالة اللي وصلها حازم قرفول لرجال الأعمال كانت جاية من مين؟,من قيادات عليا في المخابرات السورية والقصر الجمهوري.,"[{'text': 'حازم كان جاي برساله بسيطه من قيادات عليا في المخابرات السوريه والقصر الجمهوري نفسه', 'start_char': 1259, 'end_char': 1341}]"
ماذا كان مصير رجال الأعمال الذين رفضوا دفع الأموال للنظام السوري؟,الاحتجاز، الإقامة الجبرية، أو مصادرة الأملاك.,"[{'text': 'بعد الاجتماع تم احتجاز بعض اللي رفضوا تسليم اصول ممتلكاتهم او اسهم شركاتهم وتشحنو على فرع المخابرات 251 في دمشق ، والبعض التاني تم وضع قايد الاقامه الجبريه', 'start_char': 1629, 'end_char': 1779}, {'text': 'وفي الايام التاليه للاجتماع هرب عدد من اغنى السوريين واستولى النظام على شركاتهم واعمالهم', 'start_char': 1891, 'end_char': 1982}]"
إيه هو الوضع المالي اللي كان نظام بشار بيواجهه وقتها؟,كان على وشك الإفلاس.,"[{'text': 'طبعا وقتها كان واضح للكل جوه وبره سوريا ان نظام بشار بيفلس ومش لاقي فلوس يمول بيها آلته الحربيه والاجرامية', 'start_char': 1143, 'end_char': 1248}]"
ما هي وسائل الإعلام العالمية التي أكدت تفاصيل الاجتماع؟,ذا ايكونوميست وفاينشال تايمز.,"[{'text': 'ذا ايكونوميست وفاينشال تايمز', 'start_char': 1819, 'end_char': 1848}]"
ما نتيجة اجتماع 2019 على مجتمع الأعمال السوري؟,هروب رجال أعمال واستيلاء النظام.,"[{'text': 'بعد الاجتماع تم احتجاز بعض اللي رفضوا تسليم اصول ممتلكاتهم او اسهم شركاتهم وتشحنو على فرع المخابرات 251 في دمشق', 'start_char': 1632, 'end_char': 1761}, {'text': 'وفي الايام التاليه للاجتماع هرب عدد من اغنى السوريين واستولى النظام على شركاتهم واعمالهم', 'start_char': 1891, 'end_char': 1985}]"
بماذا وُصفت ثروات رجال الأعمال نتيجة تسهيلات النظام؟,وُصفت بأنها متضخمة.,"[{'text': 'والتسهيلات اللي خدوها واللي ساهمت في تضخم ثرواتهم', 'start_char': 961, 'end_char': 1011}]"
مين أبرز شخصية اتحطت تحت الإقامة الجبرية بعد الاجتماع؟,رامي مخلوف ابن خال بشار الأسد.,"[{'text': 'وابرزهم رامي مخلوف ابن خال بشار الاسد', 'start_char': 1839, 'end_char': 1873}]"
ماذا يمكن استنتاجه عن ثقافة السلامة المرورية بهانوي؟,ضعف إجراءات السلامة,"[{'text': 'يا جماعه البسوا هلمت عشان الدنيا اخطر', 'start_char': 1974, 'end_char': 2011}, {'text': 'ودي هو اعتبر الطاقية هيلمت', 'start_char': 2073, 'end_char': 2098}]"
بماذا يتميز توقيت نشاط السوق الأول الذي زاره المتحدث؟,نشاطه ليلي,"[{'text': 'احنا عرفنا ان هو بيجهزوا دلوقتي السوق للاجواء بالليل', 'start_char': 1076, 'end_char': 1131}, {'text': 'سالت حد قال زي ما سمعتو يعني ، قال ان هو شغال بالليل', 'start_char': 1845, 'end_char': 1897}]"
أين يقع أول سوق زاره المتحدث بالنسبة للمدينة؟,نص ساعه بره المدينه,"[{'text': 'نص ساعه بره المدينه', 'start_char': 312, 'end_char': 331}]"
من هم الزبائن المحتملون للسوق بناءً على توقيت عمله؟,السكان المحليين العاملين,"[{'text': 'دي بقى بتاعه الناس السكان المحليين مش الناس السياح', 'start_char': 226, 'end_char': 274}, {'text': 'دايما حاجات الخضار بتبقى بالنهار بدري ، فمش عارف ليه ده غريب شويه وشغال بالليل يعني', 'start_char': 1748, 'end_char': 1836}]"
كيف يمكن وصف الطقس في هانوي كما ذكر المتحدث؟,رطب,"[{'text': 'الجو بقى الرطوبه عاليه', 'start_char': 1543, 'end_char': 1564}]"
كم كان سعر فاكهة الجاك فروت في السوق؟,بدولار واحد,"[{'text': 'بدولار واحد', 'start_char': 756, 'end_char': 766}]"
لماذا اعتبر المتحدث عمل السوق ليلاً أمراً غريباً؟,لأن أسواق الخضار نهارية,"[{'text': 'دايما حاجات الخضار بتبقى بالنهار بدري', 'start_char': 1047, 'end_char': 1083}, {'text': 'فمش عارف ليه ده غريب شويه وشغال بالليل يعني', 'start_char': 1085, 'end_char': 1129}]"
كيف وصف المتحدث أصناف المانجو المعروضة في السوق الأول؟,متنوعة,"[{'text': 'مانجا انواع بقى كتير من المانجا يعني', 'start_char': 458, 'end_char': 491}, {'text': 'لكن في هنا انواع مانجا كتير ما شفتهاش جوه نهائي', 'start_char': 622, 'end_char': 670}]"
ما هي وسيلة المواصلات التي طلبها المتحدث للذهاب إلى الترين ستريت؟,سكوتر,"[{'text': 'طلبنا سكوتر يجي ياخدنا', 'start_char': 1464, 'end_char': 1485}]"
ما الأمر الغريب في توقيت عمل السوق الأول؟,سوق خضار يعمل ليلاً,"[{'text': 'دايما حاجات الخضار بتبقى بالنهار بدري ، فمش عارف ليه ده غريب شويه وشغال بالليل يعني', 'start_char': 1109, 'end_char': 1188}, {'text': 'سالت حد قال زي ما سمعتو يعني ، قال ان هو شغال بالليل', 'start_char': 1191, 'end_char': 1236}]"
,,
ما هو اليوم المفضل للمتحدث خلال رحلاته في قارة آسيا؟,يوم الماركتز,"[{'text': 'ده احلى يوم بحبه في رحلات اسيا ، يوم الماركتز', 'start_char': 40, 'end_char': 81}]"
