Question,Answer,Quotes
إيه هي السمعة اللي ارتبطت بشيكاغو حسب كلام المتحدث؟,الجرايم والاسلحه والمخدرات والعصابات الشهيره,"[{'text': 'الجرايم والاسلحه والمخدرات والعصابات الشهيره', 'start_char': 148, 'end_char': 191}]"
إيه اللي بيخلي الكلاود جيت مكان كويس لبداية جولة في شيكاغو؟,محاط بالحدائق وناطحات السحاب.,"[{'text': 'الميزة في المكان هنا ان حواليه حديقه غايه في الجمال والروعه .', 'start_char': 1718, 'end_char': 1779}, {'text': 'فزي ما انتم شايفين كل المباني عاليه ازاي وناطحات السحاب كلها حوالينا .', 'start_char': 1872, 'end_char': 1941}]"
,,
إيه هو الترتيب الاقتصادي لمدينة شيكاغو في أمريكا؟,ثالث اكبر اقتصاد في امريكا كلها,"[{'text': 'ثالث اكبر اقتصاد في امريكا كلها', 'start_char': 281, 'end_char': 309}]"
إزاي زيارة ناطحة سحاب بتغير الصورة النمطية لشيكاغو؟,بإظهار ريادتها المعمارية,"[{'text': 'اول حاجه هتيجي في دماغك هي الجرايم والاسلحه والمخدرات والعصابات الشهيره', 'start_char': 125, 'end_char': 203}, {'text': 'اول نطحه سحاب في العالم طلعت من شيكاغو هنا', 'start_char': 412, 'end_char': 457}]"
إيه السمة الأساسية للأسعار في شارع جولد كوست؟,الغلاء.,"[{'text': 'واغلى شوارع المدينه اسمه جولد كوست', 'start_char': 469, 'end_char': 502}]"
حسب كلام المتحدث، إيه هو اسم عصابة شيكاغو الشهيرة؟,عصابه الكابون,"[{'text': 'عصابه الكابون', 'start_char': 195, 'end_char': 207}]"
إيه التناقض بين واقع كلاود جيت والصورة اللي ذكرها المتحدث لشيكاغو؟,أنها وجهة سياحية عالمية.,"[{'text': 'لو قلت لك شيكاغو ، اول حاجه هتيجي في دماغك هي الجرايم والاسلحه والمخدرات والعصابات الشهيره', 'start_char': 56, 'end_char': 161}, {'text': 'هي من معالم شيكاغو ومن معالم امريكا كلها كمان', 'start_char': 1720, 'end_char': 1765}, {'text': 'اجواء عالميه 100 % مفيش كلام بعد الكلام . مكان لذيذ بصوا كميه البشر اللي واقفه بتتصور هنا قد ايه ؟', 'start_char': 1792, 'end_char': 1888}]"
إيه هي السمة المميزة لرحلات المتحدث حول العالم؟,المغامرة.,"[{'text': 'مسافر مغامر مصري بتاع اكشن نجوب العالم', 'start_char': 696, 'end_char': 738}]"
إيه هي الأسماء التانية اللي المتحدث قالها للكلاود جيت؟,البقليله اللي موجوده دي او البينز,"[{'text': 'البقليله اللي موجوده دي او البينز', 'start_char': 1705, 'end_char': 1733}]"
إزاي اتغيرت نظرة المتحدث لشيكاغو بعد زيارته ليها؟,وجد شعبها رايق ومتعاون.,"[{'text': 'لو قلت لك شيكاغو ، اول حاجه هتيجي في دماغك هي الجرايم والاسلحه والمخدرات والعصابات الشهيره زي عصابه الكابون المعروفه باسم مافيا شيكاغو .', 'start_char': 65, 'end_char': 179}, {'text': 'خدت بالي ان الشعب هناك رايق جدا ، الناس جميله في الشارع ، الناس بجد متعاونه وبتساعد .', 'start_char': 511, 'end_char': 597}]"
إزاي انطباع المتحدث عن نظام شوارع شيكاغو بيتناقض مع الفكرة المسبقة عنها؟,منظمة عكس سمعتها,"[{'text': 'لو قلت لك شيكاغو ، اول حاجه هتيجي في دماغك هي الجرايم والاسلحه والمخدرات والعصابات الشهيره زي عصابه الكابون المعروفه باسم مافيا شيكاغو .', 'start_char': 73, 'end_char': 219}, {'text': 'المباني فيها ونظامها والشوارع بتاعتها نظام غير عادي بصراحه .', 'start_char': 1251, 'end_char': 1312}]"
إيه هو الاسم التاني اللي اشتهرت بيه عصابة الكابون؟,مافيا شيكاغو,"[{'text': 'مافيا شيكاغو', 'start_char': 222, 'end_char': 234}]"
