Question,Answer,Quotes
إيه الفرق الأساسي في طبيعة السوقين المذكورين؟,الأول محلي والتاني سياحي,"[{'text': 'دي بقى بتاعه الناس السكان المحليين مش الناس السياح', 'start_char': 133, 'end_char': 178}, {'text': 'والناس بتجي بقى مخصوص من كل مكان في العالم عشان تحضر الماركت ده', 'start_char': 851, 'end_char': 917}]"
كيف بدت طريقة عرض الفواكه النادرة في السوق الأول؟,مهملة,"[{'text': 'دراجون فروت مرميه في الارض .', 'start_char': 876, 'end_char': 903}, {'text': 'متخيلين دي بتتحط عندنا بتتحط جوه التلاجه', 'start_char': 905, 'end_char': 947}, {'text': 'مرميه في الارض الجاك فروت مرميه في الارض .', 'start_char': 1019, 'end_char': 1061}]"
إيه الاسم اللي بيطلقه السكان المحليين على الترين ماركت؟,ترين ستريت,"[{'text': 'هنا بيسموه ترين ستريت', 'start_char': 1421, 'end_char': 1442}]"
إزاي شركة الضمان بتستفيد من عمر صلاحية المنتج؟,بتحصيل أموال بلا خدمة,"[{'text': 'وعقبال بقى لما الحاجه تبوظ علشان يعني تاريخ صلاحيتها خلص بكل بساطه ، هيكون كده كده الضمان بتاعك خلص .', 'start_char': 1391, 'end_char': 1512}, {'text': 'وبكده تكون الشركه بتاعه الضمان يعني عملت فيك واحد صفر واخذت الفلوس من غير ما تعمل اي حاجه ثانيه .', 'start_char': 1558, 'end_char': 1665}]"
ما هي طبيعة العلاقة بين الشركة الأساسية وشركة الضمان؟,التعاون,"[{'text': 'الشركه الاساسيه بتكون متعاونه مع شركه الضمان', 'start_char': 1787, 'end_char': 1827}]"
ما هو موقف زوجة المتحدث من صوت التلاجة؟,ده شيء مرفوض تماما,"[{'text': 'ده شيء مرفوض تماما', 'start_char': 129, 'end_char': 147}]"
إيه الافتراض الأساسي لنموذج عمل شركات الضمان؟,المستهلك بيحافظ على حاجته,"[{'text': 'ان هم بيخلوا بالهم من الحاجه بتاعتهم . ده الشيء الطبيعي المنطقي', 'start_char': 1466, 'end_char': 1526}, {'text': 'فالضمان بيعتمد عليك انت المستهلك العاقل اللي اكيد 100 % مش هيبوظ الحاجه بتاعته .', 'start_char': 1572, 'end_char': 1653}]"
ماذا فعل المتحدث نتيجة لصعوبة تواصله مع الشركة لحل مشكلة الثلاجة؟,بحث على يوتيوب,"[{'text': 'فانا ما قدرتش استنى ودخلت على اليوتيوب ابدا ادور بنفسي عن سبب الصوت ده', 'start_char': 510, 'end_char': 585}]"
ماذا اكتشف المتحدث بخصوص صوت الثلاجة الجديدة؟,ان ده شيء عادي جدا,"[{'text': 'ان ده شيء عادي جدا', 'start_char': 610, 'end_char': 628}]"
إزاي تجربة المتحدث بتدعم رأي الخبير في الضمان؟,دفع الضمان على الفاضي,"[{'text': 'ومره واحده لقيت ان الصوت اختفى .', 'start_char': 400, 'end_char': 430}, {'text': 'دورت اكتر عشان افهم الفكره بتاعه الضمان اللي انا دفعت فلوسه على الفاضي ده', 'start_char': 488, 'end_char': 562}, {'text': 'فكل بساطه الضمان عمل منك فلوس على ولا حاجه', 'start_char': 1575, 'end_char': 1616}]"
وفقًا للمتحدث، ما الذي يجب أن يكون من اهتمامات الشركة تجاه العميل؟,سعادته بالمنتج,"[{'text': 'ان هو يكون سعيد بالمنتج ؟', 'start_char': 461, 'end_char': 483}]"
من أين عرفت زوجة المتحدث لأول مرة عن صوت الثلاجة؟,من الفيديو ده,"[{'text': 'وعلى فكره هي هتعرف المعلومه دي لاول مره من الفيديو ده', 'start_char': 180, 'end_char': 231}]"
إزاي تجربة المتحدث بتدعم تحليل الخبير للضمان؟,لأنهم لا يقدمون الخدمة.,"[{'text': 'فليه كل الموال ده علشان اكلم حد يجي يصلحها ؟', 'start_char': 326, 'end_char': 374}, {'text': 'وبكده تكون الشركه بتاعه الضمان يعني عملت فيك واحد صفر واخذت الفلوس من غير ما تعمل اي حاجه ثانيه .', 'start_char': 1478, 'end_char': 1585}]"
ما الذي سببه صوت الثلاجة للمتحدث؟,الإزعاج,"[{'text': 'بالنسبه لي الموضوع اكيد كان مزعج', 'start_char': 98, 'end_char': 128}]"
ما الذي تقدمه الشركة الأساسية لشركة الضمان؟,فلوس,"[{'text': 'فلوس', 'start_char': 1867, 'end_char': 1871}]"
إيه أساس النموذج الربحي لشركات الضمان؟,حرص المستهلك وانتهاء الصلاحية,"[{'text': 'فالضمان بيعتمد عليك انت المستهلك العاقل اللي اكيد 100 % مش هيبوظ الحاجه بتاعته .', 'start_char': 1916, 'end_char': 1994}, {'text': 'وعقبال بقى لما الحاجه تبوظ علشان يعني تاريخ صلاحيتها خلص بكل بساطه ، هيكون كده كده الضمان بتاعك خلص .', 'start_char': 2026, 'end_char': 2126}]"
ما هو الشعور الذي تملّك المتحدث عندما أصدرت الثلاجة صوتاً لأول مرة؟,الخوف,"[{'text': 'وبعد ما وصلت التلاجه حصل اكتر حاجه انا كنت خايف منها', 'start_char': 29, 'end_char': 79}]"
ما هو السبب المنطقي لحرص الناس على ممتلكاتهم؟,انت اكيد مش عايزها تبوظ علشان انت هتفضل قاعد فتره من غيرها لو باظت,"[{'text': 'انت اكيد مش عايزها تبوظ علشان انت هتفضل قاعد فتره من غيرها لو باظت .', 'start_char': 1269, 'end_char': 1342}]"
إيه الهدف من الحرب النفسية المذكورة؟,قتل الروح وتطبيع الموت.,"[{'text': 'وازاي ان الاعداء بتوعنا بيستخدموا الموضوع ده علشان يقتلونا وده جزء من الحرب السيكولوجيه والاعلاميه اللي بتحصل .', 'start_char': 666, 'end_char': 779}, {'text': 'هم قتلوا الروح بتاعتنا وهم فازوا وخلاص احنا بقينا نتعود على الارقام', 'start_char': 1386, 'end_char': 1450}]"
حسب النص، إيه كان الشعور العام في بداية الحرب؟,الاهتزاز والخوف الشديد.,"[{'text': 'كلنا كنا مهزوزين ويعني خايفين جدا على اهلنا هناك .', 'start_char': 345, 'end_char': 395}]"
إزاي المتحدث بيوصف القناة بتاعته؟,المدونه البصريه بتاعتي,"[{'text': 'المدونه البصريه بتاعتي', 'start_char': 2220, 'end_char': 2241}]"
إيه نتيجة التعود على المآسي حسب وصف المتحدث؟,تبلد الإحساس,"[{'text': 'اول لما كنت بتسمع الاخبار وهي طالعه من من هناك و زي كلنا كنا مهزوزين ويعني خايفين جدا على اهلنا هناك . كنا نسمع رقم ان في 300 شهيد ولسه الارقام في اول كم يوم احنا ما كناش بنعرف ننام .', 'start_char': 196, 'end_char': 367}, {'text': ""دلوقتي حالا لما انت بتسمع رقم ان عدد الشهداء في غزه اللي احنا عارفينه لحد دلوقتي وصل ل 000'40 , الموضوع ما بيهزكش من جوه زي ما كان بيهزك ويخليك ما بتعرفش تنام اول لما بدا خالص ."", 'start_char': 1251, 'end_char': 1446}]"
,,
حسب النص، إيه اللي حصل في لبنان في يوم واحد؟,في يوم واحد في 500 شخص توفوا في لبنان,"[{'text': 'في يوم واحد في 500 شخص توفوا في لبنان', 'start_char': 504, 'end_char': 542}]"
إيه الدليل اللي قاله المتحدث على نجاح الحرب النفسية؟,تضاؤل التأثر بأعداد الضحايا.,"[{'text': 'كنا نسمع رقم ان في 300 شهيد ولسه الارقام في اول كم يوم احنا ما كناش بنعرف ننام .', 'start_char': 311, 'end_char': 395}, {'text': ""دلوقتي حالا لما انت بتسمع رقم ان عدد الشهداء في غزه اللي احنا عارفينه لحد دلوقتي وصل ل 000'40 , الموضوع ما بيهزكش من جوه زي ما كان بيهزك ويخليك ما بتعرفش تنام اول لما بدا خالص ."", 'start_char': 1222, 'end_char': 1404}]"
,,
إيه اللي المتحدث عاوز يحفظه من خلال الفيديو ده؟,اللحظه الغريبه في في التاريخ اللي احنا عايشين فيه دلوقتي,"[{'text': 'اللحظه الغريبه في في التاريخ اللي احنا عايشين فيه دلوقتي', 'start_char': 2380, 'end_char': 2435}]"
إيه نتيجة استغلال الأعداء لتعود الناس على المآسي؟,قتل الروح المعنوية.,"[{'text': 'وازاي ان الاعداء بتوعنا بيستخدموا الموضوع ده علشان يقتلونا', 'start_char': 861, 'end_char': 916}, {'text': 'وده جزء من الحرب السيكولوجيه والاعلاميه اللي بتحصل', 'start_char': 917, 'end_char': 967}, {'text': 'قتلوا الروح بتاعتنا', 'start_char': 1307, 'end_char': 1324}]"
إيه الحالة النفسية اللي بيشعر بيها الشخص تجاه نفسه لما يلاحظ تغيره؟,الصدمة.,"[{'text': 'اول حاجه الشخص فعلا يكون مصدوم فيها من من نفسه', 'start_char': 1498, 'end_char': 1544}]"
حسب النص، إيه اللي المتحدث بيحاول يفسره للمشاهدين؟,ايه سبب الشعور ده,"[{'text': 'ايه سبب الشعور ده', 'start_char': 1500, 'end_char': 1517}]"
ما هدف الحرب النفسية التي ذكرها المتحدث؟,القتل النفسي,"[{'text': 'ازاي احنا فعلا مع الوقت ممكن نتعود على حاجات في منتهى البشاعه', 'start_char': 864, 'end_char': 927}, {'text': 'وازاي ان الاعداء بتوعنا بيستخدموا الموضوع ده علشان يقتلونا وده جزء من الحرب السيكولوجيه والاعلاميه اللي بتحصل', 'start_char': 928, 'end_char': 1032}]"
حسب النص، وعي من الذي تم التلاعب به؟,وعي المجتمع.,"[{'text': 'وازاي اتلعب بال الوعي الاجتماعي لناس كتيره .', 'start_char': 1122, 'end_char': 1166}]"
من أي جانب هيشرح المتحدث فكرة التعود على المآسي؟,من جانب الخبره بتاعتي اعلاميا,"[{'text': 'من جانب الخبره بتاعتي اعلاميا', 'start_char': 774, 'end_char': 802}]"
إزاي منع الأدينوسين بيسبب الشعور بالسعادة؟,بيحسن أداء الدوبامين,"[{'text': 'في دراسه اتعملت في 2015 بتقول ان الدوبامين بيشتغل بصوره افضل في حال انه ارتبط بالكافيين ، وده بيحصل لما بيتم منع مستقبلات الادينوسين من العمل في الدماغ .', 'start_char': 1876, 'end_char': 2015}, {'text': 'الدوبامين ماده منبهه طبيعيه بيتم انتاجها في دماغ الانسان ، واللي البعض بيعتبره ماده كيميائيه ممتعه لان الدوبامين هو اللي بيحفز الدماغ على الشعور بالنشاط والسعاده .', 'start_char': 2017, 'end_char': 2191}]"
ما هي العلاقة بين بنية الكافيين الكيميائية والأدينوسين؟,بنيتهما الكيميائية متشابهة,"[{'text': 'الكافين بيشبه في البنيه الكيميائيه بتاعته ماده بتتكون في الدماغ اسمها الادينوسين .', 'start_char': 1146, 'end_char': 1235}]"
ما هو التأثير الذي يحدثه الكافيين على تدفق الدم للمخ؟,بيقلل من تدفق الدم للمخ بحوالي 27 %,"[{'text': 'الكافيين بيقلل من تدفق الدم للمخ بحوالي 27 %', 'start_char': 2419, 'end_char': 2465}]"
بناءً على النص، إيه السبب المحتمل للصداع اللي بيعالجه الكافيين؟,تضخم الأوعية الدموية بالدماغ.,"[{'text': 'بيعتبر الكافيين احد المكونات الرئيسيه لمعظم ادويه الصداع والصداع النصفي', 'start_char': 2169, 'end_char': 2244}, {'text': 'واللي بدوره بيقلل من عمليه تضخم الاوعيه الدمويه في الدماغ', 'start_char': 2326, 'end_char': 2383}]"
,,
بماذا يُعتبر الكافيين على مستوى العالم حسب النص؟,الماده ذات التاثير النفسي الاكثر استخداماً في العالم كله,"[{'text': 'وعلشان كده يعتبر الكافيين هو الماده ذات التاثير النفسي الاكثر استخداماً في العالم كله .', 'start_char': 496, 'end_char': 576}]"
ما هما الناقلان العصبيان اللذان يتأثران عند تثبيط الأدينوسين بفعل الكافيين؟,الأدرينالين والدوبامين.,"[{'text': 'الجسم بيبدا يفرز ادرينالين يحل محل الادينوسين', 'start_char': 1416, 'end_char': 1461}, {'text': 'الدوبامين بيشتغل بصوره افضل في حال انه ارتبط بالكافيين ، وده بيحصل لما بيتم منع مستقبلات الادينوسين من العمل في الدماغ', 'start_char': 1895, 'end_char': 2013}]"
,,
إيه اللي بيحصل لمستقبلات الأدينوسين عند اللي بيستهلكوا الكافيين بكثرة؟,مستقبلات الادينوسين في الدماغ بتزيد عندهم,"[{'text': 'مستقبلات الادينوسين في الدماغ بتزيد عندهم', 'start_char': 1739, 'end_char': 1779}]"
إيه ممكن يحصل لو مستهلك كافيين منتظم وقّف فجأة؟,الشعور بالنعاس الشديد,"[{'text': 'والماده دي هي اللي بتخلي الانسان يشعر بالنعاس وما بتقلش في الجسم غير لما الانسان ينام .', 'start_char': 1109, 'end_char': 1184}, {'text': 'ومن الجدير بالذكر ان الناس اللي بيستخدموا الكافيين بصوره كبيره ، مستقبلات الادينوسين في الدماغ بتزيد عندهم', 'start_char': 1600, 'end_char': 1701}]"
,,
ما هو متوسط استهلاك الكافيين اليومي على مستوى العالم؟,من 110 مل غرام لي 300 مل غرام,"[{'text': 'متوسط استهلاكه على مستوى العالم من 110 مل غرام لي 300 مل غرام', 'start_char': 893, 'end_char': 951}]"
إيه اللي بيحصل لفاعلية الكافيين مع الاستخدام المستمر؟,فاعليتها بتقل,"[{'text': 'بيخلي مدمنين القهوه عايزين منها كميات اكبر دائماً علشان بس يحصلوا على نفس التاثير اللي ممكن فنجان قهوه صغير يعمله في واحد مش بيشرب القهوه كتير', 'start_char': 1791, 'end_char': 1933}]"
ما هي طبيعة تأثير الكافيين على وظائف المخ حسب النص؟,تأثيره مُغيِّر مؤقت.,"[{'text': 'بالاضافه لكونه واحد من المواد اللي بتعمل تغيير مؤقت في وظائف المخ', 'start_char': 675, 'end_char': 738}]"
كم تبلغ نسبة الكافيين في كوب القهوة العادي المنتشر؟,حوالي 95 مل غرام,"[{'text': 'وكوبايه القهوه العاديه المنتشره اليومين دول نسبه الكافيين فيها حوالي 95 مل غرام', 'start_char': 954, 'end_char': 1032}]"
إيه الرسالة الضمنية اللي بيقدمها المتحدث عن السفر؟,تحدي الصور النمطية.,"[{'text': 'لو قلت لك شيكاغو ، اول حاجه هتيجي في دماغك هي الجرايم والاسلحه والمخدرات والعصابات الشهيره زي عصابه الكابون المعروفه باسم مافيا شيكاغو .', 'start_char': 66, 'end_char': 189}, {'text': 'هسيبكم تحكموا بعد ما نخلص جولتنا في شيكاغو اللي هنعرف من خلالها حكايه البلد مع ناطحات السحاب بالتفصيل', 'start_char': 201, 'end_char': 296}]"
,,
ما هو اسم أغلى شارع في شيكاغو الذي يبيع الماركات العالمية الفاخرة؟,جولد كوست,"[{'text': 'اغلى شوارع المدينه اسمه جولد كوست', 'start_char': 324, 'end_char': 351}]"
ما الذي يميز هوية شيكاغو المعمارية حسب النص؟,الريادة في بناء ناطحات السحاب,"[{'text': 'طبعا شيكاغو كلها ناطحات سحاب', 'start_char': 2204, 'end_char': 2231}, {'text': 'لان اول نطيحه سحاب في العالم طلعت من شيكاغو هنا', 'start_char': 2245, 'end_char': 2288}]"
ما هو الانطباع الذي كوّنه المتحدث عن شعب شيكاغو والذي يتناقض مع السمعة الشائعة للمدينة؟,شعبها رايق ومتعاون.,"[{'text': 'لو قلت لك شيكاغو ، اول حاجه هتيجي في دماغك هي الجرايم والاسلحه والمخدرات والعصابات الشهيره', 'start_char': 49, 'end_char': 154}, {'text': 'خدت بالي ان الشعب هناك رايق جدا ، الناس جميله في الشارع ، الناس بجد متعاونه وبتساعد .', 'start_char': 418, 'end_char': 498}]"
ما هو الترتيب الاقتصادي لمدينة شيكاغو على مستوى أمريكا؟,ثالث اكبر اقتصاد في امريكا كلها,"[{'text': 'ثالث اكبر اقتصاد في امريكا كلها', 'start_char': 241, 'end_char': 273}]"
كيف يختلف انطباع المتحدث عن سكان شيكاغو عن سمعتها؟,وجد الناس رايقين ومتعاونين,"[{'text': 'لو قلت لك شيكاغو ، اول حاجه هتيجي في دماغك هي الجرايم والاسلحه والمخدرات والعصابات الشهيره زي عصابه الكابون المعروفه باسم مافيا شيكاغو .', 'start_char': 35, 'end_char': 177}, {'text': 'خدت بالي ان الشعب هناك رايق جدا ، الناس جميله في الشارع ، الناس بجد متعاونه وبتساعد .', 'start_char': 494, 'end_char': 585}]"
إيه السمة اللي بتميز رحلات المتحدث حول العالم؟,المغامرة.,"[{'text': 'مسافر مغامر مصري', 'start_char': 683, 'end_char': 700}]"
"ما هي المادة المصنوع منها معلم ""كلاود جيت"" السياحي؟",سيلفر ستانلس ستيل,"[{'text': 'سيلفر ستانلس ستيل', 'start_char': 1162, 'end_char': 1179}]"
بماذا يواجه المتحدث الصورة النمطية لشيكاغو؟,بإنجازها المعماري.,"[{'text': 'لو قلت لك شيكاغو ، اول حاجه هتيجي في دماغك هي الجرايم والاسلحه والمخدرات والعصابات الشهيره زي عصابه الكابون المعروفه باسم مافيا شيكاغو .', 'start_char': 53, 'end_char': 192}, {'text': 'اول نطحه سحاب في العالم طلعت من شيكاغو هنا .', 'start_char': 341, 'end_char': 391}]"
إلى أي بلد ينتمي المتحدث الذي يستكشف ثقافات العالم؟,مصر,"[{'text': 'فانا شريف نبيل مسافر مغامر مصري بتاع اكشن نجوب العالم نحكي قصص الناس وثقافات الناس', 'start_char': 668, 'end_char': 752}]"
ما هو الوقت الذي اقترحه المتحدث لزيارة كلاود جيت لتكون فارغة؟,سبعة الصبح,"[{'text': 'سبعة الصبح', 'start_char': 1735, 'end_char': 1744}]"
إزاي الطابع المعماري لشيكاغو أثر على خطة المتحدث؟,قرر يزور ناطحة سحاب,"[{'text': 'طبعا شيكاغو كلها ناطحات سحاب', 'start_char': 2008, 'end_char': 2037}, {'text': 'وعشان كده المكان اللي هنروحوا دلوقتي هو واحد من اهم الاماكن في شيكاغو عشان نشوف شيكاغو كله من فوق من ناطحه سحاب منهم', 'start_char': 2146, 'end_char': 2272}]"
كيف وصف المتحدث تنظيم شوارع ومباني شيكاغو؟,منظمة بشكل غير عادي.,"[{'text': 'المباني فيها ونظامها والشوارع بتاعتها نظام غير عادي', 'start_char': 1451, 'end_char': 1503}]"
ما هي حشوة ساندوتش الكرواسان الذي تناوله المتحدث في وجبة الإفطار؟,التونه والزبيب وعليها شيدر من فوق سايحه,"[{'text': 'التونه والزبيب وعليها شيدر من فوق سايحه', 'start_char': 1076, 'end_char': 1109}]"
توقيت عمل سوق الخضار بيوحي بإيه عن روتين سكان هانوي؟,بيشتروا حاجاتهم بالليل.,"[{'text': 'عرفنا ان هو بيجهزوا دلوقتي السوق للاجواء بالليل', 'start_char': 1127, 'end_char': 1175}, {'text': 'دايما حاجات الخضار بتبقى بالنهار بدري ، فمش عارف ليه ده غريب شويه وشغال بالليل يعني', 'start_char': 1932, 'end_char': 2014}]"
ماذا استنتج المتحدث عن بعض الفواكه من طريقة عرضها للبيع؟,رخصها.,"[{'text': 'دراجون فروت مرميه في الارض . متخيلين دي بتتحط عندنا بتتحط جوه التلاجه ، مقفول عليها وحاطين سعر مثلا ايه 1000 جنيه او 70 الف درهم حاجه كده', 'start_char': 999, 'end_char': 1099}, {'text': 'في ايه يا جماعه مرميه في الارض الجاك فروت مرميه في الارض .', 'start_char': 1100, 'end_char': 1124}]"
أين يقع السوق الأول الذي زاره المتحدث بالنسبة للمدينة؟,نص ساعه بره المدينه,"[{'text': 'نص ساعه بره المدينه', 'start_char': 323, 'end_char': 342}]"
ليه المتحدث استغرب من توقيت عمل سوق الخضار؟,لأنه يعمل مساءً فقط.,"[{'text': 'دايما حاجات الخضار بتبقى بالنهار بدري ، فمش عارف ليه ده غريب شويه وشغال بالليل يعني ، سالت حد قال زي ما سمعتو يعني ، قال ان هو شغال بالليل', 'start_char': 1452, 'end_char': 1568}]"
,,
بماذا يُعرف سوق القطار أيضًا في هانوي؟,ترين ستريت,"[{'text': 'ماركت القطر الترين ماركت او الترين ستريت ، هنا بيسموه ترين ستريت', 'start_char': 1475, 'end_char': 1539}]"
إيه الفرق بين أنواع المانجا في السوق المحلي والمناطق السياحية؟,تنوع أصناف المانجا.,"[{'text': 'دايما في المانجا الصفرا الطويله ، دي بيقطعوها للناس للسياح في الشارع', 'start_char': 417, 'end_char': 483}, {'text': 'لكن في هنا انواع مانجا كتير ما شفتهاش جوه نهائي', 'start_char': 485, 'end_char': 531}]"
كيف وصف المتحدث حالة الطقس في هانوي؟,الجو رطب.,"[{'text': 'الجو بقى الرطوبه عاليه', 'start_char': 1716, 'end_char': 1736}, {'text': 'جد والله الرطوبه رهيبه', 'start_char': 1802, 'end_char': 1823}]"
ما هي وسيلة المواصلات التي طلبها المتحدث للذهاب إلى الترين ستريت؟,سكوتر,"[{'text': 'طلبنا سكوتر يجي ياخدنا', 'start_char': 1640, 'end_char': 1661}]"
إزاي حالة السوق الأول كانت عكس المعتاد لأسواق الخضار؟,شغال بالليل بدل الصبح,"[{'text': 'دايما حاجات الخضار بتبقى بالنهار بدري ، فمش عارف ليه ده غريب شويه وشغال بالليل يعني', 'start_char': 1610, 'end_char': 1683}, {'text': 'سالت حد قال زي ما سمعتو يعني ، قال ان هو شغال بالليل', 'start_char': 1686, 'end_char': 1735}]"
كيف وصف المتحدث حالة الفاكهة والخضار في السوق الأول؟,طزاجتها.,"[{'text': 'الفاكهه طازه والخضار شكله طازه ، ورايق وخطير بصراحه يعني .', 'start_char': 533, 'end_char': 595}]"
إيه هو أحلى يوم بيحبه المتحدث في رحلاته لآسيا؟,يوم الماركتز,"[{'text': 'يوم الماركتز', 'start_char': 64, 'end_char': 75}]"
